{
  "schema": "cortex.result/v1",
  "id": "123e4567-e89b-42d3-a456-426614174000",
  "created_at": "2026-01-02T03:04:05Z",
  "producer": {
    "agent": "builder",
    "run": "run-001"
  },
  "work_item": "spec-02b",
  "body": {
    "status": "done",
    "summary": "All criteria are met.",
    "changes": [],
    "evidence": [],
    "usage": {
      "input_tokens": 1,
      "output_tokens": 2,
      "duration_ms": 3
    }
  }
}
